{"schema":"geometry.step_topology.render.result.a0","session":{"session_handle":"gts_1111111111111111111111111111111111111111111111111111111111111111","generation":7},"artifact":{"artifact_handle":"gtg_2222222222222222222222222222222222222222222222222222222222222222","content_sha256":"7fa646430db55036b9b854b32c2f8d6f37fd929bf6c74fa31b55d33605719cb4","render_artifact_handle":"gtr_4444444444444444444444444444444444444444444444444444444444444444","render_content_sha256":"5555555555555555555555555555555555555555555555555555555555555555","binding_layout":"node-primitive-a0","geometry_length_unit":"meter","source_length_unit":"millimeter","counts":{"meshes":1,"instances":1,"primitives":1,"geometry_triangles":12,"instanced_triangles":12}},"glb":{"name":"glb","media_type":"model/gltf-binary","format":"glb-2.0","bytes":15,"sha256":"7fa646430db55036b9b854b32c2f8d6f37fd929bf6c74fa31b55d33605719cb4"}}
